{
  "project": "pathologic2-marble-nest",
  "projectDisplayName": "Pathologic 2: Marble Nest",
  "generatedAt": "2025-10-20T13:30:00Z",
  "sourceTextHash": "8f4c3d9...",
  "segments": [
    {
      "segmentId": "conv:6192355001750781",
      "speaker": "Executor",
      "speakerRole": "NPC",
      "tone": "ominous",
      "scope": "quest/theatre_finale",
      "summary": "Executor reminds the Bachelor that death awaits downstairs.",
      "tags": ["warning", "death"],
      "glossaryTerms": ["concept:death_personification"],
      "confidence": 0.78,
      "knowledgeReferences": ["character:executor", "concept:death_personification"]
    }
  ]
}
